id,name,index_photo,href,tagline,bg_photo,mainphoto,quote,bio,edu,work,twitter,linkedin,facebook,github,rss,treehouse,codeschool,coderwall,fav1,fav2,fav3,fav4,otherfav1,otherfav2,otherfav3,otherfav4,otherfav5,website1,website2,website3,website4,cohort,role,name,,name@flatironschool.com1,Alex Chiu,http://students.flatironschool.com/./img/alex_chiu_profile_pic.jpg,students/alex_chiu.html,test,http://students.flatironschool.com/PLACEHOLDER,http://students.flatironschool.com/../img/alex_chiu_profile_pic.jpg,Anything is possible it is the beauty of living!! -- Alex Chiu.," Aspiring web developer, currently enrolled at the Flatiron School 003. I spent the first 7 years of my career at the Boeing company, designing and building the cabin of the 787 Dreamliner. As the internet and mobile applications has grown to take over the world, I realized I needed new skills to design and innovate the next big thing. On my free time you can find me rock climbing in th summer, snowboarding in the winter and scuba diving while I am traveling. ","B.E. Electrical Engineering and Math, Stony Brook University M.S. Engineering Management,University of Southern California ", System Engineer for Cabin Interior of the 787 The Boeing Company ,https://twitter.com/TheRealChiu,http://www.linkedin.com/profile/view?id=160096053&trk=nav_responsive_tab_profile_pic,,https://github.com/AYC726,#,http://teamtreehouse.com/,http://www.codeschool.com/users/,https://coderwall.com/,Singapore,Seattle,San Francisco,New York,#,#,#,,,http://ayc726.github.io/,#,,,Ruby 003,Alumnus,Alex,Chiu,AlexChiu@flatironschool.com2,Brendan Manley,http://students.flatironschool.com/img/students/brendan_manley_profile.jpg,students/brendan_manley.html,test,http://students.flatironschool.com/PLACEHOLDER,http://students.flatironschool.com/../img/students/brendan_manley_profile.jpg,"Where there's a will, there are countless ways. -- Mister Gepetto."," I grew up on the east end of Long Island, so I have inherited a lifelong love and devotion to the sea. Although I wouldn't classify myself as an animal hoarder, I do have a lot of animals (mostly dogs). I am new to code, but I love every moment I spend staring at it. And I occasionally type some.. ",University of Miami The Flatiron School , platform for students to rate the social lives of their universities ,https://twitter.com/,http://www.linkedin.com/,,https://github.com/,#,http://teamtreehouse.com/brendanmanley,http://www.codeschool.com/users/manleyhimself,https://coderwall.com/manleyhimself,Miami,Boston,Charleston,New York,http://en.wikipedia.org/wiki/Wikipedia,http://www.penny-arcade.com/,#,,,#,#,,,Ruby 003,Alumnus,Brendan,Manley,BrendanManley@flatironschool.com3,Raymond Gan,http://students.flatironschool.com/img/students/raymond_gan_profile.jpg,students/raymond_gan.html,test,http://students.flatironschool.com/PLACEHOLDER,http://students.flatironschool.com/../img/students/raymond_gan_profile.jpg,Easy is boring. I prefer hard. - Me," As a former spinal surgery guy, chemical engineer, web developer, and teacher, I love creativity and a steep learning curve. Want to help people in multiple industries with my code. Am passionate about studying algorithms and fascinated by machine learning. I also love writing and analyzing people. Would love to be a consultant, serving customers in multiple fields. Am also interested in entertainment/television and medical applications, like expert systems with IBM Watson (http://ibm.co/NGYzyj) to help doctors make smarter medical diagnoses. ","UC Berkeley, BS Chemical Engineering (with Applied Physics) Stanford CS 106A (Programming Methodology, in Java) Stanford Machine Learning (Coursera) "," Hanover Medical | Sentient Medical Surgical Neurophysiologist for 4 years. Started in Boston at 5 hospitals connected to Harvard Medical School. Worked on 400+ spinal surgeries at 50+ hospitals with 50+ orthopedic and neurosurgeons, in Los Angeles, Boston, Chicago, Baltimore, Ohio, S. Carolina, and Georgia. Princeton Review Tutored college and high school students for 8 years. Also taught MCAT at Harvard and Boston University. IBM Global Services Consulting Web/database developer and consultant for 3 software companies. Built e-commerce and Oracle database sites for different clients. Programmed in Java, EJB, JSP, Unix (Korn shell), ASP, SQL, HTML, etc. ",https://twitter.com/rgan0,http://www.linkedin.com/pub/raymond-gan/1/801/ba,,https://github.com/rayning0?tab=repositories,http://rayning0.github.io/,http://teamtreehouse.com/raymondgan,https://www.codeschool.com/users/rayning,https://coderwall.com/rayning0,Los Angeles,"Berkeley, California",Paris,New York,http://projecteuler.net/,http://www.berkeleybreathed.com/pages/09bloomlibrary.asp,http://www.thisamericanlife.org/,,,http://rayning0.github.io/,,,,Ruby 003,Alumnus,Raymond,Gan,RaymondGan@flatironschool.com4,Charlotte Chang,http://students.flatironschool.com/img/students/charlotte_chang_profile.png,students/charlotte_chang.html,test,http://students.flatironschool.com/PLACEHOLDER,http://students.flatironschool.com/../img/students/charlotte_chang_profile.png,"Here's to the crazy ones. The misfits. The rebels. The troublemakers. The round pegs in the square holes. The ones who see things differently. They're not fond of rules. And they have no respect for the status quo. You can quote them, disagree with them, glorify or vilify them. About the only thing you can't do is ignore them. Because they change things. They push the human race forward. And while some may see them as the crazy ones, we see genius. Because the people who are crazy enough to think they can change the world, are the ones who do.  -- Apple Inc."," Find me knee deep in a side scroller, making horrible latte art, making up names for horrible latte art, running slowly, tripping quickly, biking with a smile, living in perpetual belief in magical realism, and habitually pursuing why/how stuff works. ",The Ohio State University Victoria College of the Arts (University of Melbourne) Grenadi School of Design ," yes, more please ",https://twitter.com/pushorpull,http://www.linkedin.com/pub/charlotte-chang/1/742/b65,,https://github.com/glamouracademy,#,http://teamtreehouse.com/glamouracademy//,http://www.codeschool.com/users/pushorpull,https://coderwall.com/glamouracademy/,This is,Too,Hard,To Choose,http://www.asofterworld.com/,http://xkcd.com/,http://www.radiolab.org/,,,http://glamouracademy.github.io/,#,,,Ruby 003,Alumnus,Charlotte,Chang,CharlotteChang@flatironschool.com5,Vivian Shangxuan Zhang,http://students.flatironschool.com/img/students/vivian-snapshot.png,students/vivianzhang.html,test,http://students.flatironschool.com/PLACEHOLDER,http://students.flatironschool.com/../img/students/vivian_icon.png,It is the age of Data Mining. Embrace it with all heart. -- Vivian Zhang Said this.," I was born and raised up in Shanghai and came to US for college. I stuided and worked in Sillicon Valley, Long Island, Rhode Island, and now happily study and work in Manhattan. ",Stony Brook University San Jose State University ," I am Co-founder and CTO of a statistical consulting firm--Supstat Inc. Our services include consulting and training on data mining, statistical computing  and visualization. We all program in R. Our lead data scientist is ranked top 0.1% by Kaggle. ",https://twitter.com/vivian__zhang,http://www.linkedin.com/in/shangxuanzhang,,https://github.com/casunlight,https://www.facebook.com/shangxuan.zhang,http://teamtreehouse.com/vivianzhang,http://www.codeschool.com/users/shangxuan,https://coderwall.com/shangxuan,Shanghai,London,Hawaii,New York,#,#,#,#,,http://www.supstat.com/en,http://www.meetup.com/nyc-open-data,http://www.statcodebank.com/,,Ruby 003,Alumnus,Vivian,ShangxuanZhang,VivianShangxuanZhang@flatironschool.com6,Ivan Brennan,http://students.flatironschool.com/img/students/ivanbrennan_index_profile.jpg,students/ivanbrennan.html,test,http://students.flatironschool.com/PLACEHOLDER,http://students.flatironschool.com/../img/students/ivanbrennan_profile.jpg,It was the best of times it was meh. -- someone smart said this.," I grew up in and around NY (Gowanus, Flatbush, New Paltz), and majored in Mathematics at Oberlin College. I moved out west pursuing a music career and lived in Oakland for a year before landing in Seattle for 10+ years. Now I'm re-exploring math and learning to program. ",Oberlin College , Custom architectural woodwork. ,https://twitter.com/,http://www.linkedin.com/,,https://github.com/,#,http://teamtreehouse.com/ivanbrennan/,http://www.codeschool.com/users/ivanbrennan/,https://coderwall.com/ivanbrennan/,New York,Barcelona,Minneapolis,New York,http://stackoverflow.com/,#,www.thisamericanlife.org/,,,http://ivanbrennan.github.io/blog/2013/09/24/hello-world/,http://ivanbrennan.tumblr.com/,,,Ruby 003,Alumnus,Ivan,Brennan,IvanBrennan@flatironschool.com7,Kyle Shike,http://students.flatironschool.com/img/students/kyleshike_index_profile.jpg,students/kyleshike.html,test,http://students.flatironschool.com/PLACEHOLDER,http://students.flatironschool.com/../img/students/kyleshike_profile.jpg,," I'm a painter and an aspiring programmer,I love art theory and most things conceptual. ",Hunter College , I worked under my father for a long stretch of time. I am a skilled woodworker. ,https://twitter.com/kyleshike,http://www.linkedin.com/pub/kyle-shike/67/a83/4b,,https://github.com/kyleshike,http://kyleshike.github.io,http://teamtreehouse.com/kyleshike/,http://www.codeschool.com/users/kyleshike,https://coderwall.com/kyleshike,Altered States,The Stranger,The Castle,,http://artsy.net,http://www.qwantz.com,http://www.openculture.com,,,http://kyleshike.github.io,,,,Ruby 003,Alumnus,Kyle,Shike,KyleShike@flatironschool.com8,Michael Polycarpou,http://students.flatironschool.com/img/students/michaelpolycarpou_index.jpg,students/michaelpolycarpou.html,test,http://students.flatironschool.com/PLACEHOLDER,http://students.flatironschool.com/../img/students/rsz_michaelpolycarpou.jpg,It was the best of times it was meh. -- someone smart said this., I was born in LA and I lived in Ohio until I was 12. I then moved to Cyprus in Europe where I attended middle and high school. After a year of mandatory military service I went to London to study Electrical Engineering. I loved building electronics but I also loved programming the things I built and connecting them to the outside world. I decided I wanted to become a web developer and enrolled in the flatiron school. ,Masters in Electrical Engineering at Imperial College London  , Processor Division Intern ,https://twitter.com/mpolycarpou,http://www.linkedin.com/pub/michael-polycarpou/43/869/1b5,,https://github.com/polycarpou,https://www.michaelpolycarpou.com,http://teamtreehouse.com/michaelpolycarpou/,http://www.codeschool.com/users/polycarpou,https://coderwall.com/polycarpou,Buenos Aires,Barcelona,Minneapolis,New York,#,#,#,,,#,#,,,Ruby 003,Alumnus,Michael,Polycarpou,MichaelPolycarpou@flatironschool.com9,Sam Yang,http://students.flatironschool.com/https://dl.dropboxusercontent.com/u/88495/sam_profile.jpg,students/sam_yang.html,test,http://students.flatironschool.com/PLACEHOLDER,http://students.flatironschool.com/https://dl.dropboxusercontent.com/u/88495/sam_profile.jpg,What you seek is seeking you.  - Rumi," After several years working in the finance industry in New York, his dreams of bringing his ideas to fruition led him to the Flatiron School. Sam is now crafting a new career in software development to realize his goal of starting up an organization that will improve the real social world, one neighborhood at a time... ","Binghamton University, BA Philosophy Cinematography, Magna cum Laude HCHS ", Business Analyst / Quality Assurance / Consultant ,https://twitter.com/samtalks,http://www.linkedin.com/ub/samuel-yang/4/633/28b,,https://github.com/samtalks,#,http://teamtreehouse.com/samtalks/,http://www.codeschool.com/users/samtalks,https://coderwall.com/samtalks,New York City,San Francisco,Los Angeles,,#,,,,,#,#,,,Ruby 003,Alumnus,Sam,Yang,SamYang@flatironschool.com10,Stephanie Oh,http://students.flatironschool.com/img/students/stephanie_index_profile.jpg,students/stephanie_oh.html,test,http://students.flatironschool.com/PLACEHOLDER,http://students.flatironschool.com/../img/students/stephanie_profile.png,Anxiety is the handmaiden of creativity. -- T.S Eliot," My background is in writing and music, and I'm adding coding to that list. As long as I'm creating, I'm happy. ","Duke University, 2009 B.A English, Theater Studies ", Writing Instructor ('12 - '13)  Talent Management ('11 - '12) ,https://twitter.com/SostephOh,http://www.linkedin.com/pub/stephanie-oh/22/537/389,,https://github.com/stephaniehoh,http://www.sostephosays.tumblr.com/,http://teamtreehouse.com/stephanieoh/,http://www.codeschool.com/users/stephaniehoh,https://coderwall.com/stephaniehoh,The Sense of an Ending by Julian Barnes,1984 by George Orwell,Arcadia by Tom Stoppard,American Pastoral by Philip Roth,http://www.pandodaily.com,http://www.hypebot.com,http://www.nytimes.com,,,#,http://www.sostephosays.tumblr.com,,,Ruby 003,Alumnus,Stephanie,Oh,StephanieOh@flatironschool.com11,David Bella,http://students.flatironschool.com/img/students/davidbella_index_profile.jpg,students/davidbella.html,test,http://students.flatironschool.com/PLACEHOLDER,http://students.flatironschool.com/../img/students/davidbella_profile.jpg,"Well, Mr. Frankel, who started the program, began to suffer from the computer disease that anybody who works with computers now knows about. It's a very serious disease and it interferes completely with the work. The trouble with computers is you play with them. They are so wonderful. -- Richard Feynman",,"University of Connecticut B.S. Computer Science 2011 Concentrations in Computer Graphics, Parallel Computing, and Computer Security ",,https://twitter.com/davidhenrybella,http://www.linkedin.com/pub/david-bella/56/a14/882,,https://github.com/davidbella,http://www.davidbella.com,http://teamtreehouse.com/davidbella/,http://www.codeschool.com/users/davidbella,https://coderwall.com/davidbella,Linus Torvalds,Zed Shaw,DHH,,http://news.ycombinator.com,http://www.reddit.com/r/programming,http://www.superbad.com,,,http://davidbella.github.io,http://www.davidbella.com,,,Ruby 003,Alumnus,David,Bella,DavidBella@flatironschool.com12,Greg Eng,http://students.flatironschool.com/img/students/greg_eng_index_profile.jpg,students/greg_eng.html,test,http://students.flatironschool.com/PLACEHOLDER,http://students.flatironschool.com/../img/students/greg_eng_profile.jpg,Go forth and set the world on fire. -- St. Ignatius of Loyola," After traversing through the lands of financial Excel spreadsheets, I'm now learning to navigate the open sea as a web developer.  - Code School - Treehouse - Codecademy - Coder Wall MadridDenverSan FranciscoNew York","Loyola University Maryland, Finance Universidad de Alcal_¿, Study Abroad ",Coming Soon..Coming Soon..,https://twitter.com/gregeng,http://www.linkedin.com/in/gregeng,,http://github.com/gregeng,http://gregeng.github.io/,#scroll-header,http://www.github.com/gregeng,http://teamtreehouse.com/gregeng/,Madrid,Denver,San Francisco,New York,http://reddit.com,http://www.youtube.com/playlist?list=PL445A12573FA04235,https://www.spotify.com/us/,,,http://gregeng.github.io,#,,,Ruby 003,Alumnus,Greg,Eng,GregEng@flatironschool.com13,Mike Spangler,http://students.flatironschool.com/img/students/mike_spangler_index_profile.jpg,students/mike_spangler.html,test,http://students.flatironschool.com/PLACEHOLDER,http://students.flatironschool.com/../img/students/mike_spangler_profile.jpg,There is no Dana.  There is only Zuul.," Mike is a member of the Flatiron School's Fall 2013 class.  Prior to entering the coding world, he produced television for Warner Bros and HBO in NYC.  He has also run corporate PR accounts at MWW Group, a top-five global independant PR firm.  Mike is a California native and Brooklyn resident.  Go Nets. ","Loyola Marymount '08  Business, Fine Arts "," Warner Bros Television - Locations Department Home Box Office - Production Office MWW Group - Associate Account Executive, Corporate Communications Group ",https://twitter.com/mikespangler,http://www.linkedin.com/pub/mike-spangler/10/3a0/788/,,https://github.com/mikespangler,#,http://teamtreehouse.com/mikespangler/,http://www.codeschool.com/users/bikespangler,https://coderwall.com/users/mikespangler,Brooklyn,Barcelona,San Sebastian,Los Angeles,http://www.bing.com,http://www.xkcd.com,http://www.radiolab.org,,,http://githubmikespangler.github.io,http://www.noregard.net/,,,Ruby 003,Alumnus,Mike,Spangler,MikeSpangler@flatironschool.com14,Anders Ramsay,http://students.flatironschool.com/img/students/anders_ramsay_index_profile.jpg,students/anders_ramsay.html,test,http://students.flatironschool.com/PLACEHOLDER,http://students.flatironschool.com/../img/students/anders_ramsay_profile.png,"Whoa, there's a lot of hash in them there tags...", Stuff about me.  What is there to say? Just read this bio instead. ,"University of Michigan, School of Information ", ,https://twitter.com/andersramsay,http://www.linkedin.com/in/andersramsay,,https://github.com/andersr,#,https://www.si.umich.edu/,http://andersco.net,http://www.github.com/andersr/,Buenos Aires,Barcelona,Minneapolis,New York,#,#,#,,,http://andersramsay.com,http://coderchronicles.org,,,Ruby 003,Alumnus,Anders,Ramsay,AndersRamsay@flatironschool.com15,Emily Xie,http://students.flatironschool.com/img/students/emily_xie_picture.jpg,students/emily_xie.html,test,http://students.flatironschool.com/PLACEHOLDER,http://students.flatironschool.com/../img/students/emily_xie_picture.jpg,"Stay hungry, stay foolish. -- Steve Jobs.","Neophile, technophile, thaasophobe. An ENFP rural Maine transplant who likes yoga, jazz, and ramen.","Harvard College, 2008 - 2012 History of Art and Architecture Skowhegan Area HS, 2004 - 2008 ",,https://twitter.com/emilyxxie,http://www.linkedin.com/in/xieemily,,https://github.com/emilyxxie,#,http://teamtreehouse.com/emilyxie/,http://www.codeschool.com/users/emilyxxie,https://coderwall.com/emilyxxie,"G__reme, Turkey","Paris, France",Singapore,"Cambridge, MA",http://etsy.com,http://en.wikipedia.org/wiki/Final_Fantasy_IX,http://www.thisamericanlife.org/,,,#,#,,,Ruby 003,Alumnus,Emily,Xie,EmilyXie@flatironschool.com16,Matt Campbell,http://students.flatironschool.com/https://scontent-a-ord.xx.fbcdn.net/hphotos-ash3/995456_10100424239956534_215898244_n.jpg,students/matt_campbell.html,test,http://students.flatironschool.com/PLACEHOLDER,http://students.flatironschool.com/https://scontent-a-ord.xx.fbcdn.net/hphotos-ash3/995456_10100424239956534_215898244_n.jpg,"People, when they are under surveillance, are already imprisoned. -- Jacob Applebaum (@ioerror)"," Ohio native, Duke 2010 grad, worked in NYC finance for 3 years before leaving to become a Ruby padawan @flatironschool. ",Duke University ,Macquarie Bank Ltd. Australian-based investment bank. I worked on a commodities derivatives trading floor.,https://twitter.com/mecampbellsoup,http://www.linkedin.com/in/mecampbellsoup,,https://github.com/mecampbellsoup,#,http://teamtreehouse.com/mattcampbell/,http://www.codeschool.com/users/mecampbellsoup,https://coderwall.com/mecampbellsoup,Shanghai,Tel Aviv,San Francisco,Vancouver,http://www.projecteuler.net,http://www.lightnessofbeingbook.com/,,,,mecampbellsoup.github.io,pensamientas.tumblr.com,,,Ruby 003,Alumnus,Matt,Campbell,MattCampbell@flatironschool.com17,Tiffany Peon,http://students.flatironschool.com/img/students/tpeon.jpg,students/tiffany_peon_profile.html,test,http://students.flatironschool.com/PLACEHOLDER,http://students.flatironschool.com/../img/students/tpeon.jpg,Nobody who ever gave his best regretted it. -- George Halas," I'm originally from Atlanta, but have split my adult life between Boston and New York City. I previously worked in Project Management at a web development agency and am now an aspiring rails developer at the Flatiron school. ",Berklee College of Music BFA Music Business/Management , BlueSwitch is a premier technology solutions provide and graphic design agency. ,http://www.twitter.com/peontiffany,http:www.linkedin.com/pub/tiffany-pe__n/13/95a/a27/,,http://github.com/tiffanypeon,#,http://teamtreehouse.com/tiffanypeon,http://www.codeschool.com/users/peontiffany,https://coderwall.com/tiffanypeon,New York,Atlanta,Sao Paulo,London,http://techcrunch.com/,http://http://theoatmeal.com/comics/design_hell,http://www.thisamericanlife.org/,,,http://tiffanypeon.github.io/,,,,Ruby 003,Alumnus,Tiffany,Peon,TiffanyPeon@flatironschool.com18,Amanda Himmelstoss,http://students.flatironschool.com/img/students/amandahimmelstossphoto.jpg,students/amanda_himmelstoss.html,test,http://students.flatironschool.com/PLACEHOLDER,http://students.flatironschool.com/../img/students/amandahimmelstossphoto.jpg,," I studied anthropology in college and still keep it close in my heart. I am fascinated in the weird and wonderful ways we use machines to be social creatures. My interests include food exploration, stories, travel, Brooklyn, and animals. ","B.A. Anthropology, Barnard College, 2011 ", A social polling platform. ,https://twitter.com/ahimmelstoss,http://www.linkedin.com/pub/amanda-himmelstoss/23/5/101,,https://github.com/ahimmelstoss,http://ahimmelstoss.github.io,http://www.github.com/ahimmelstoss,http://teamtreehouse.com/ahimmelstoss/,http://www.codeschool.com/users/ahimmelstoss,New York,Lisbon,Istanbul,Los Angeles,http://www.airbnb.com,http://theoatmeal.com/,http://themoth.org/,,,http://ahimmelstoss.github.io/,,,,Ruby 003,Alumnus,Amanda,Himmelstoss,AmandaHimmelstoss@flatironschool.com19,Bana Malik,http://students.flatironschool.com/img/students/student_name_index_profile.jpg,students/bana_malik.html,test,http://students.flatironschool.com/PLACEHOLDER,http://students.flatironschool.com/http://media-cache-ec0.pinimg.com/avatars/bandanakm-1357094487_600.jpg,You are not just a drop in the ocean. You are the mighty ocean in the drop. - JalÙl ad-DÙn R_mÙ," I grew up in New York, just outside the city. I'm an ecologist by background now learning to code to bring new ideas to life. Love to run, roller blade, get my groove on, and wander my favorite city--New York. ","Barnard College, Columbia University 2001-2005, English Yale University, 2008-2010, Environmental Science ", Work on large scale ecological projects in the developing world through Sikh temples and heritage sites. ,https://twitter.com/BandanaKM,http://www.linkedin.com/pub/bandana-kaur-malik/43/385/b0,,https://github.com/BandanaKM,,http://teamtreehouse.com/,https://www.codeschool.com/account?__utma=1.2112672413.1375757081.1380240960.1380661703.7&__utmb=1.2.10.1380661703&__utmc=1&__utmk=147981367&__utmv=-&__utmx=-&__utmz=1.1375757081.1.1.utmcsr%3D%28direct%29%7Cutmccn%3D%28direct%29%7Cutmcmd%3D%28none%29,https://coderwall.com/,New York (esp. Brooklyn),"Edinburgh, Scotland","Seville, Spain","Amritsar, Punjab",http://earthengine.google.org/,http://www.theonion.com/,http://www.kcrw.com/,,,http://bandanakm.github.io/,http://instagram.com/bandanakm,,,Ruby 003,Alumnus,Bana,Malik,BanaMalik@flatironschool.com20,Chris Lee,http://students.flatironschool.com/img/students/student_name_index_profile.jpg,students/chrislee.html,test,http://students.flatironschool.com/PLACEHOLDER,http://students.flatironschool.com/../img/students/chrislee.jpg,"If you don__Òt love something, you__Òre not going to go the extra mile, work the extra weekend, challenge the status quo as much. -- Steve Jobs", Aspiring to help create the world we live in. ,Carnegie Mellon University Windward School , Capital Strategies Analyst. Equity Capital Markets - Media & Technology Analyst. ,https://twitter.com/Creeefs,http://www.linkedin.com/pub/christopher-lee/9/558/483,,https://github.com/Clee681,#,http://teamtreehouse.com/christopherlee,http://www.codeschool.com/users/Clee681,https://coderwall.com/clee681,Los Angeles,Tokyo,Barcelona,New York City,http://www.newyorker.com/,http://www.chrisrock.com/,http://ecorner.stanford.edu/podcasts.html,,,clee681.github.io,,,,Ruby 003,Alumnus,Chris,Lee,ChrisLee@flatironschool.com21,Daniel Chang,http://students.flatironschool.com/img/students/daniel_chang_profile.png,students/daniel_chang.html,test,http://students.flatironschool.com/PLACEHOLDER,http://students.flatironschool.com/../img/students/daniel_chang_profile.png,Stay close to any sounds that make you glad you are alive. -- Hafiz," Once a teacher, now a coder. I enjoy biking, swimming, cooking, making music (violin, viola and voice). ",," I've worked for 6 years as a middle and high school math teacher in New York City. In 2011, I took a summer internship at an advertising agency where I began learning how to code. In 2013 I finally decided to transition into the tech world. ",https://twitter.com/,http://www.linkedin.com/,,https://github.com/,#,http://teamtreehouse.com/rosiehoyem/,http://www.codeschool.com/users/rosalita,https://coderwall.com/,Tokyo,New York,Minneapolis,Shanghai,http://www.bbc.co.uk/,http://xkcd.com/,http://www.thisamericanlife.org/,,,http://danielchangnyc.github.io/,http://www.tumblr.com/blog/c0uchpanda,,,Ruby 003,Alumnus,Daniel,Chang,DanielChang@flatironschool.com