id,name,index_photo,href,tagline,bg_photo,mainphoto,quote,bio,edu,work,twitter,linkedin,facebook,github,rss,treehouse,codeschool,coderwall,fav1,fav2,fav3,fav4,otherfav1,otherfav2,otherfav3,otherfav4,otherfav5,website1,website2,website3,website4,cohort,role,name,,name@flatironschool.com22,Ian Miller,http://students.flatironschool.com/img/students/ian_miller_pic.jpg,students/ian_miller.html,test,http://students.flatironschool.com/PLACEHOLDER,http://students.flatironschool.com/../img/students/ian_miller_pic.jpg,"Two roads diverged in a wood, and I__Î I took the one less traveled by, and that has made all the difference. - Robert Frost"," I am a recent transplant to NYC from Washington, DC, where I worked in renewable energy project development for two years.  I'm currently a Rubywan at the Flatiron School, and I am planning to immerse myself into web development. ","University of North Carolina, 2011 University of Sydney, 2010 "," I worked as an Associate in Business Development at Sol Vista, a commercial building energy efficiency start-up based in Silver Spring, MD. ",https://twitter.com/irmiller22,http://www.linkedin.com/pub/ian-miller/2a/834/201,,https://github.com/irmiller22,http://irmiller22.github.io/,http://teamtreehouse.com/fabulouslearner95/,http://www.codeschool.com/users/irmiller22,https://coderwall.com/irmiller22,Sydney,San Francisco,Paris,,http://www.economist.com/,http://calvinhobbesdaily.tumblr.com/,http://blog.pmarca.com/,,,http://irmiller22.github.io/,http://archaicpositives.tumblr.com/,,,Ruby 003,Alumnus,Ian,Miller,IanMiller@flatironschool.com23,Iris Lee,http://students.flatironschool.com/img/students/iris_lee_profile.jpg,students/iris_lee.html,test,http://students.flatironschool.com/PLACEHOLDER,http://students.flatironschool.com/../img/students/iris_lee_profile.jpg,I have no special talent. I am only passionately curious. -- Albert Einstein," I grew up in NJ playing a lot of music. In college, I studied music licensing and copyright. Before Flatiron, I was a marketer at a music/tech startup. In my spare time I enjoy solving puzzles, reading, cooking, watching movies, and hiking. ","Northeastern University, Music ", Marketing Coordinator ,https://twitter.com/iris_lee,http://www.linkedin.com/in/irislee1,,https://github.com/irislee,http://irislee.github.io/,http://teamtreehouse.com/irislee2/,http://www.codeschool.com/users/irislee13,https://coderwall.com/irislee,City: New York,Food: warm apple crisp a la mode,Sound: animals drinking water,Time of Day: early morning,http://www.reddit.com/,http://www.nytimes.com/crosswords/index.html,http://knowyourmeme.com/memes/grumpy-cat,http://www.radiolab.org/,,http://irislee.github.io/,,,,Ruby 003,Alumnus,Iris,Lee,IrisLee@flatironschool.com24,James Tong,http://students.flatironschool.com/img/students/student_name_index_profile.jpg,students/jamesjtong.html,test,http://students.flatironschool.com/PLACEHOLDER,http://students.flatironschool.com/../img/students/student_name_profile.jpg,"Glory is fleeting, but obscurity is forever. - Napoleon Bonaparte (1769-1821)", James embarks on his journey to follow his passion to build great websites and apps. James hopes to level up his skills in computer programming at the Flatiron School. ,"Flatiron School, Web Development Binghamton University, B.S. Finance "," Whitney Realty Corp.,  Assistant Property ManagerCapstone Volatility Manager, Back Office Operations and Product ControlUBS Equity Research, Equity Research Intern",https://twitter.com/jamesjtong,http://www.linkedin.com/pub/james-tong/2b/7b9/78a,,https://github.com/jamesjtong,#,http://teamtreehouse.com,http://www.codeschool.com/users/usk,https://coderwall.com/,Shanghai,Miami,New York,,stackoverflow.com,#,#,,,http://jamesjtong.com,#,,,Ruby 003,Alumnus,James,Tong,JamesTong@flatironschool.com25,Joe O'Conor,http://students.flatironschool.com/img/students/joe_oconor_index_profile.jpg,students/joe_oconor.html,test,http://students.flatironschool.com/PLACEHOLDER,http://students.flatironschool.com/../img/students/joe_oconor_profile.jpg,"Make it work, make it right, make it fast. -- Kent Beck"," After growing up in the quiet suburbs of Minneapolis, I headed to big New York City for college. After an urban Ivy League education, I sought adventure in the field as an officer in the Marine Corps. Now I'm taking aim at something else -- building awesome things with code. ","BA Economics, Columbia University ", Communciations officer for the world's best expeditionary fighting force Tutor in Math and Economics,https://twitter.com/jnoconor,http://www.linkedin.com/in/jnoconor,,https://github.com/jnoconor,http://jnoconor.github.io/atom.xml,http://teamtreehouse.com/jnoconor/,http://www.codeschool.com/users/jnoconor,https://coderwall.com/jnoconor,Minneapolis,New York,"Washington, DC",Paris,http://www.newsblur.com,http://www.smbc-comics.com/,http://thisamericanlife.org,,,http://jnoconor.github.io,http://jnoconor.tumblr.com,,,Ruby 003,Alumnus,Joe,O'Conor,JoeO'Conor@flatironschool.com26,Jeanne Roniger,http://students.flatironschool.com/img/students/jeanneronigerprofile.jpg,students/jeanne_roniger.html,test,http://students.flatironschool.com/PLACEHOLDER,http://students.flatironschool.com/../img/students/jeanneronigerprofile.jpg,All life is an experiment. -- Ralph Waldo Emerson.," Being a web developer has been on the back of my mind for awhile now, so I'm thrilled to be learning full stack development at Flatiron. When I'm not coding, you can find me playing ultimate frisbee. ","Electrical Engineering, The University of Texas at Austin Civil Engineering, The University of Texas at Austin "," Proposal Engineer, Isolux Corsan Civil Engineer, EDP Renewables",https://twitter.com/jronigr,http://www.linkedin.com/in/jronigr,,https://github.com/jronigr,#,http://teamtreehouse.com/jronigr/,http://www.codeschool.com/users/jronigr,https://coderwall.com/jronigr,Austin,San Francisco,New York,Portland,http://www.etsy.com,http://www.xkcd.com,http://acltv.com/,,,http://jronigr.github.com,,,,Ruby 003,Alumnus,Jeanne,Roniger,JeanneRoniger@flatironschool.com27,John Richardson,http://students.flatironschool.com/img/students/student_name_index_profile.jpg,students/john_richardson.html,test,http://students.flatironschool.com/PLACEHOLDER,http://students.flatironschool.com/../img/students/john_richardson_profile.png,The net-net is bad for fish -- JMR, Worked in advertising for years as an account planner. Changed careers to data analysis. Looking to get more useful. ,MA Columbia BA Cornell , Data analyst for health behavior change RCT. ,https://twitter.com/richardsonjm,http://www.linkedin.com/pub/john-richardson/4/1b/267/,,https://github.com/richardsonjm,#,http://teamtreehouse.com/richardsonjm/,http://www.codeschool.com/users/richardsonjm,https://coderwall.com/richardsonjm,Chicago,Willsboro,Freiburg,New York,http://getprismatic.com/news/home,http://sarahsilvermanonline.com/,http://www.cartalk.com/,,,http://lifecount.tumblr.com/,http://cliffsofinsanity.tumblr.com/,,,Ruby 003,Alumnus,John,Richardson,JohnRichardson@flatironschool.com28,Josh Scaglione,http://students.flatironschool.com/img/students/josh_index.jpg,students/josh_scaglione.html,test,http://students.flatironschool.com/PLACEHOLDER,http://students.flatironschool.com/../img/students/josh_scaglione.jpg,Experience is simply the name we give our mistakes. ~Oscar Wilde," I'm an erstwhile visual effects artist, technical writer, animator, fantasy writer, and a huge tabletop gaming nerd. I've been coding sporadically since I was in middle school, and I'm ecstatic to be coming back to it. ",Purchase College Colgate University ," Marketing Department, Technical Writer/Intern  Post Production, Visual Effects Assistant ",https://twitter.com/j_scag_,http://www.linkedin.com/pub/josh-scaglione/7a/85a/188,,https://github.com/J-Scag,http://j-scag.github.io,http://teamtreehouse.com/jscag/,http://www.codeschool.com/users/jscag,https://coderwall.com/j_scag,New York,New York,New York,NEW YORK,https://github.com,http://ruby-doc.org/,https://www.reddit.com,,,http://j-scag.github.io,#,,,Ruby 003,Alumnus,Josh,Scaglione,JoshScaglione@flatironschool.com29,Logan Hasson,http://students.flatironschool.com/img/students/logan_hasson_index_profile.jpg,students/loganhasson.html,test,http://students.flatironschool.com/PLACEHOLDER,http://students.flatironschool.com/../img/students/logan_hasson_profile.jpg,"It behooves every man to remember that the work of the critic is of altogether secondary importance, and that in the end, progress is accomplished by the man who does things. --Theodore Roosevelt"," I majored in English at Duke University, but I probably should have known in 6th grade after writing a board game in Pascal for a book report assignment that I'd one day be a programmer. It took me until now to jump on it. Better late than never though, right? ","Duke University, 2012 - English North Carolina School of the Arts, 2007 - Concentration in Violin Performance "," 6th Grade English teacher in Bronx, NY  Production Intern ",https://twitter.com/loganhasson,http://www.linkedin.com/pub/logan-hasson/1b/a11/92,,https://github.com/loganhasson,#,http://teamtreehouse.com/loganhasson/,http://www.codeschool.com/users/loganhasson,https://coderwall.com/loganhasson,"New York, NY","Bogot_¿, Colombia","Durham, NC","Cremona, Italy",http://daringfireball.net,http://xkcd.com,http://www.radiolab.org/,,,http://loganhasson.github.io,http://loganhasson.com,http://literalcaptions.com,http://instagram.com/loganhasson,Ruby 003,Alumnus,Logan,Hasson,LoganHasson@flatironschool.com30,Manuel Neuhauser,http://students.flatironschool.com/img/students/manuel_neuhauser_index_profile.jpg,students/manuel_neuhauser.html,test,http://students.flatironschool.com/PLACEHOLDER,http://students.flatironschool.com/../img/students/manuel_neuhauser_profile.jpg,It was the best of times it was meh. -- someone smart said this.," I was born and raised in Austria ... almost.  Except for this timeframe in my late teens where I lived in the Tar Heel state - North Carolina.  There, I enjoyed my time in college and commenced my first job as a Network Consulting Engineer, which later brought me to New Jersey. After a few years of work, I decided it was time to learn something new: Ruby on Rails. ",North Carolina State UniversityMaster Computer Science ," Cisco Systems, inc. ",https://twitter.com/NeuhauserManuel,http://www.linkedin.com/in/neuhauser,,https://github.com/manu3569,,http://teamtreehouse.com/manu/,http://www.codeschool.com/users/manu3569,https://coderwall.com/manu3569,"Salzburg, Austria",New York,"Montclair, NJ",New York,http://www.slashdot.org/,http://en.wikipedia.org/wiki/List_of_The_Simpsons_comics,http://fm4.orf.at/unlimited,,,http://manu3569.github.io/,,,,Ruby 003,Alumnus,Manuel,Neuhauser,ManuelNeuhauser@flatironschool.com31,Margaret Lee,http://students.flatironschool.com/img/students/marge_index.jpg,students/margaret_lee.html,test,http://students.flatironschool.com/PLACEHOLDER,http://students.flatironschool.com/../img/students/marge_profile.jpg,"Today I am happy. Are you? -Elsa Dees, 5"," Grew up in Minnesota, married mom of two girls, Juliana 8, Elsa 5. I want to make something that will help me be a less 'busy' parent (note: parents may be the only ones who get this) ","Johns Hopkins University, Baltimore MD Harvard Business School, Boston MA THE Flatiron School, now ",,https://twitter.com/margeleedees2,http://www.linkedin.com/margaretleedees2,,https://github.com/margaretleedees2,#,http://teamtreehouse.com/margaretleedees2/,http://www.codeschool.com/users/margaretleedees2,https://coderwall.com/margaretleedees2,My Family,The Vacuum that is the NYC Mayorial Race,Mad Men Season 7,,http://mommypoppins.com/,http://www.scarymommy.com/,http://www.urbanbaby.com/,,,http://margaretleedees2.github.io/,,,,Ruby 003,Alumnus,Margaret,Lee,MargaretLee@flatironschool.com32,Rosie Hoyem,http://students.flatironschool.com/img/students/rosiehoyem_index_profile.jpg,students/rosiehoyem.html,test,http://students.flatironschool.com/PLACEHOLDER,http://students.flatironschool.com/../img/students/rosiehoyem_profile.jpg,"Cities have the capability of providing something for everybody, only because, and only when, they are created by everybody. -- Jane Jacobs, The Death and Life of Great American Cities"," Before learning to program, my path took me through the design, urban planning, policy, and environmental worlds. I've spent time in the trenches dealing with really big problems facing our world. I'm learning to program so I will be more equipt to solve them. ","Cornell University,  Master of Regional Planning University of Minnesota,  BA in Architecture ", Senior Project Manager with a small policy and finance consulting firm. ,https://twitter.com/rhoyem,www.linkedin.com/in/rosiehoyem/,,https://github.com/rosiehoyem,http://rosiehoyem.github.io/,http://teamtreehouse.com/rosiehoyem/,http://www.codeschool.com/users/rosalita,https://coderwall.com/rosalita,Buenos Aires,Barcelona,Minneapolis,New York,https://www.couchsurfing.org,http://theoatmeal.com/,http://www.radiolab.org/,,,http://rosiehoyem.com/,http://rosiehoyem.tumblr.com/,,,Ruby 003,Alumnus,Rosie,Hoyem,RosieHoyem@flatironschool.com33,Sam Owens,http://students.flatironschool.com/img/students/student_name_index_profile.jpg,students/sam_owens.html,test,http://students.flatironschool.com/PLACEHOLDER,http://students.flatironschool.com/../img/students/samowens.jpg,Learning to Speak Computer," I was born and raised in the Philadelphia, PA area. I enjoy outdoor sports and generally enjoy geek culture. ",,,https://twitter.com/SamuelDOwens,www.linkedin.com/pub/samuel-owens/7a/661/23a/,,https://github.com/samueldowens,feed:https://news.ycombinator.com/rss,http://teamtreehouse.com/samuelowens,http://www.codeschool.com/,https://coderwall.com/samueldowens,Philadelphia,New York,Chicago,Boston,https://news.ycombinator.com/news,http://achewood.com/,http://www.rdio.com,,,http://samueldowens.github.io/,https://twitter.com/SamuelDOwens,,,Ruby 003,Alumnus,Sam,Owens,SamOwens@flatironschool.com34,Saron Yitbarek,http://students.flatironschool.com/https://si0.twimg.com/profile_images/1865399448/image.jpg,students/saron_yitbarek.html,test,http://students.flatironschool.com/PLACEHOLDER,http://students.flatironschool.com/https://si0.twimg.com/profile_images/1865399448/image.jpg,Don't be an idiot. - the Office," I used to be scared of dogs. Then I saw one take a piss on the street corner. In front of everyone. I'm still scared of dogs, but now I think they're kind of gross. ",University of Maryland University of Awesome , Blurb about company... ,https://twitter.com/saronyitbarek,http://www.linkedin.com/in/saronyitbarek,,https://github.com/sarony,#,http://teamtreehouse.com/saronyitbarek/,http://www.codecademy.com/coursepro25303,https://coderwall.com/saronyitbarek,Buenos Aires,Barcelona,Minneapolis,New York,#,#,#,,,www.saronyitbarek.com,www.bloggytoons.com,,,Ruby 003,Alumnus,Saron,Yitbarek,SaronYitbarek@flatironschool.com35,Scott Luptowski,http://students.flatironschool.com/img/students/student_name_index_profile.jpg,students/scottluptowski.html,test,http://students.flatironschool.com/PLACEHOLDER,http://students.flatironschool.com/../img/students/scottluptowski_profile.png,," World traveler, food eater, bike rider, music listener. Passionately curious eternal stuent. Aspiring web developer. ","MSc, Lund University, Lund, Sweden BA, Drake University, Des Moines, Iowa "," Digital Strategy for Leo Burnett / Arc Worldwide advertising agency in Chicago, IL. ",https://twitter.com/scottluptowski,http://www.linkedin.com/in/scottluptowski,,https://github.com/scottluptowski,#,http://teamtreehouse.com/scottluptowski/,http://www.codeschool.com/users/scottluptowski,https://coderwall.com/scottluptowski,Berlin,Amsterdam,New York,Tokyo,http://www.nytimes.com,http://www.tottenhamhotspur.com,,,,http://www.scottluptowski.com,,,,Ruby 003,Alumnus,Scott,Luptowski,ScottLuptowski@flatironschool.com36,Sonja Hall,http://students.flatironschool.com/img/students/sonja_hall_profile.jpg,students/sonja_hall.html,test,http://students.flatironschool.com/PLACEHOLDER,http://students.flatironschool.com/../img/students/sonja_hall_profile.jpg,"Neither from itself nor from another Nor from both, Nor without a cause, Does anything whatever, anywhere arise. __Î -Nagarjuna, buddhist priest and philosopher"," Hailing from the lakes of Minnesota - with pit stops in San Francisco, Barcelona, Lucca, Bamako, Colorado, and DC - and after 8 years of writing, editing and art/design, I have a newfound passion for web development and design. Enter Flatiron School of Coding. :) ",University of Minnesota - Twin Cities Gustavus Adolphus College ," Graphic Designer - Cushman & Wakefield Senior Editor, Writer - DesignerPages.com U.S. Fulbright Scholar - Barcelona, Spain Editorial Assistant - Dwell Magazine ",https://twitter.com/,http://www.linkedin.com/,,https://github.com/,#,http://teamtreehouse.com/rosiehoyem/,http://www.codeschool.com/users/rosalita,https://coderwall.com/,"Bled, Slovenia","Sienna, Italy","Minneapolis, MN","Minturn, CO",http://www.lynda.com/,http://en.wikipedia.org/wiki/Red_Sonja,http://www.npr.org/rss/podcast/podcast_detail.php?siteId=9911203,,,http://www.cyclingnutella.blogspot.com,,,,Ruby 003,Alumnus,Sonja,Hall,SonjaHall@flatironschool.com37,Theo Vora,http://students.flatironschool.com/http://farm6.staticflickr.com/5441/9925796136_c716cd12f0_n.jpg,students/theovora.html,test,http://students.flatironschool.com/PLACEHOLDER,http://students.flatironschool.com/http://farm6.staticflickr.com/5441/9925796136_c716cd12f0_q_d.jpg,"Without visibility, there can be no debugging. -- Dr. Gordon Novak"," Born and raised in Houston, Texas. I enjoy helping others achieve their goals with technology. Struggled to learn Ruby on Rails by myself for a few years, but I finally wised up and came to Flatiron. ",University of Texas at Austin ," I am the technology conceirge for several small businesses in Houston, Texas. Jack of all trades - hardware, software, installations, and support. Web app development will soon be added to that list. ",https://twitter.com/theevo,http://www.linkedin.com/in/theovora,,https://github.com/theevo,http://theevo.github.io/atom.xml,http://www.github.com/theevo,http://teamtreehouse.com/theovora/,http://www.codeschool.com/users/railsnoob,"Poipu, Kauai, Hawaii","Bangkok, Thailand","Bath, UK","Austin, Texas",http://www.macrumors.com/,http://theoatmeal.com/comics/tesla,http://twit.tv/show/macbreak-weekly,,,http://theevo.github.io,http://twitter.com/rails_noob,,,Ruby 003,Alumnus,Theo,Vora,TheoVora@flatironschool.com38,Trevor McKendrick,http://students.flatironschool.com/img/students/trevor_mckendrick_index_profile.jpg,students/trevor_mckendrick.html,test,http://students.flatironschool.com/PLACEHOLDER,http://students.flatironschool.com/../img/students/trevor_mckendrick_profile.jpeg,It's kind of fun to do the impossible. - Walt Disney, I speak Spanish and run a profitable iOS product company. But now I'm learning to be a software developer and make products on my own. I love tech. ,Brigham Young University Master's of Accounting , ,https://twitter.com/trevmckendrick,http://www.linkedin.com/in/trevormckendrick,,https://github.com/TrevMcKendrick,http://trevormckendrick.com,http://teamtreehouse.com/rosiehoyem/,http://www.codeschool.com/users/trevmckendrick,https://coderwall.com/trevmckendrick,,,,,,,,,,http://avc.com,http://cdixon.org,http://news.ycombinator.com,,Ruby 003,Alumnus,Trevor,McKendrick,TrevorMcKendrick@flatironschool.com39,Vinney Cavallo,http://students.flatironschool.com/img/students/vinney_cavallo_profile.jpg,students/vinneycavallo.html,test,http://students.flatironschool.com/PLACEHOLDER,http://students.flatironschool.com/../img/students/vinney_cavallo_profile.jpg,"Doubt is not a pleasant condition, but certainty is an absurd one - Voltaire"," There's poetry in modeling data in a way that is both useful to humans and understandable by machines. I'm primarily interested in the art and logic of creation and the result of smashing created objects and ideas into the real world of particles, proteins and people. ",School of Visual Arts University of Vermont New Rochelle High School ," I worked as a project manager at Plus Factory, with responsibilities that straddled the line between the social world of clients and the creative / logical mechanics of development. ",https://twitter.com/vinneycavallo,http://linkedin.com/pub/vinney-cavallo/21/52b/233,,https://github.com/vcavallo,#,http://www.github.com/vcavallo,http://teamtreehouse.com/vinneycavallo,http://www.codeschool.com/users/vcavallo,New York,Los Angeles,Wyoming,,http://google.com,https://www.google.com/search?q=robert+crumb&oq=robert+crumb,http://rationallyspeaking.blogspot.com/,,,http://vcavallo.github.io/,http://vinneycavallo.com/news,http://deadlegband.com,,Ruby 003,Alumnus,Vinney,Cavallo,VinneyCavallo@flatironschool.com40,Patrick Janson,http://students.flatironschool.com/img/students/patrick_janson_index_profile.jpg,students/patrick_janson.html,test,http://students.flatironschool.com/PLACEHOLDER,http://students.flatironschool.com/../img/students/patrick_janson_profile.jpg,__£Adopt the pace of nature: her secret is patience__Ñ __Î Ralph Waldo Emerson, Grew up in Bucks County Pennsylvania. Played and coached lacrosse internationally. Professional background in real estate private equity. Currently attending Flatiron and couldn__Òt be happier. ,"University of Colorado at Boulder, BA 2007  ", Private Equity Firm ,https://twitter.com/,http://www.linkedin.com/,,https://github.com/PHJ45,#,http://teamtreehouse.com/phj45,http://www.codeschool.com/users/ltrain,https://coderwall.com/sug45,New York City,Boulder,Vabcouver,San Sebastian,https://medium.com/,http://en.wikipedia.org/wiki/Calvin_and_Hobbes,http://radiolingua.com/shows/spanish/coffee-break-spanish/,,,#,#,,,Ruby 003,Alumnus,Patrick,Janson,PatrickJanson@flatironschool.com41,Edina Vath,http://students.flatironschool.com/img/students/edinav.jpg,students/edina_vath.html,test,http://students.flatironschool.com/PLACEHOLDER,http://students.flatironschool.com/../img/students/edinav.jpg,A human is a system for converting dust billions of years ago into dust billions of years from now via a roundabout process which involves checking email a lot.," I could never put aside my LEGO mindstorm for more than two weeks, I am obsessed with drones and sentry guns, I watch unhealthy amounts of math related videos on Youtube and when I see my code running smoothy-smooth I experience inappropriate amounts of joy.  I _Ò¿ Ruby, RoR & everything open source. I am super curious to see how 3Dprinting will change our environment as it gets more and more accessible. ",Baruch College - Zicklin School of Business CIS major/ math minor LAGCC - Business Administration , The best surprise is no surprise. ,https://twitter.com/EdinaVath,http://www.linkedin.com/EdinaVath,,https://github.com/EdinaVath,#,http://teamtreehouse.com/edinavath/,http://www.codeschool.com/users/edinavath,https://coderwall.com/,New York City,Budapest,Tokyo,Venice,http://www.hackmanhattan.com,http://www.instructables.com,http://pbfcomics.com/,http://www.noagendashow.com,http://www.intelligencesquared.com/,EdinaVath.github.io,,,,Ruby 003,Alumnus,Edina,Vath,EdinaVath@flatironschool.com,,,,,,,,,,,,,,,,,,,,,,,,,,,,,,,,,,,,,,,,,,,,,,,,,,,,,,,,,,,,,,,,,,,,,,,,